{
  "contract_name": "LivingWaterAI.C8C9.Work6.FundingAccountIsolationInput",
  "contract_version": "C8C9-W6-FAII-v1.0.0",
  "baseline_id": "C8C9-BL-20260926T1014+0800-W1-5a1038869805a25e",
  "run_id": "w6-run-001",
  "work3_handoff": {
    "contract_name": "LivingWaterAI.C8C9.Work3.ContextHandoffResult",
    "contract_version": "C8C9-W3-CHO-v1.0.1-RECHECK2",
    "baseline_id": "C8C9-BL-20260926T1014+0800-W1-5a1038869805a25e",
    "work2_contract_version": "C8C9-W2-UIC-v1.0.1-RECHECK1",
    "context_handoff_id": "C8C9-W3-7b807e1e632b682a2d56452f1d174762",
    "run_id": "w6-run-001",
    "owner": {
      "funding_domain": "US_BROKER",
      "broker": "QA_BROKER",
      "account": "QA_ACCOUNT"
    },
    "currency": "USD",
    "final_target": {
      "allocation_id": "C-W6-FINAL-W6-001",
      "authorization_reference": "C-W6-FINAL-W6-001",
      "confirmation_proof": {
        "confirmed_at": "2026-09-27T02:42:00+08:00",
        "confirmed_by": "qa-client"
      },
      "payload": {
        "instrument_targets": {
          "QQQ": {
            "project_target_position": 1000.0
          },
          "BOND": {
            "project_target_position": 500.0
          }
        }
      }
    },
    "client_state_context": {
      "run_id": "w6-run-001",
      "source_namespace": "C.CLIENT_STATE",
      "payload": {
        "client_id": "client-w6",
        "portfolio_id": "portfolio-w6"
      },
      "data_as_of": "2026-09-27T02:42:00+08:00",
      "source_reference_ids": [
        "client-ref"
      ]
    },
    "funding_context": {
      "settlement": {
        "cash_basis": "AVAILABLE",
        "cash_state": {
          "total": 1000.0,
          "available": 800.0,
          "unsettled": 100.0,
          "reserved": 100.0
        },
        "source_status": "SETTLED"
      },
      "executable_budget": {
        "equity": {
          "amount": 450.0,
          "currency": "USD",
          "cash_basis": "AVAILABLE",
          "owner": {
            "funding_domain": "US_BROKER",
            "broker": "QA_BROKER",
            "account": "QA_ACCOUNT"
          }
        },
        "bond": {
          "amount": 350.0,
          "currency": "USD",
          "cash_basis": "AVAILABLE",
          "owner": {
            "funding_domain": "US_BROKER",
            "broker": "QA_BROKER",
            "account": "QA_ACCOUNT"
          }
        }
      },
      "remaining_target_gap": {
        "v82": {
          "mode": "V82_EXISTING_RUNTIME_DERIVED",
          "payload": {
            "source_owned": true,
            "asset": "QQQ"
          }
        },
        "v75": {
          "mode": "V75_EXISTING_EXPLICIT_GAP",
          "payload": {
            "remaining_target_gap_amount": {
              "amount": "310.00",
              "currency": "USD"
            }
          }
        }
      },
      "sgov_boundary": {
        "v70_original_dry_powder": {
          "amount": {
            "amount": "200.00",
            "currency": "USD"
          },
          "weight": 0.2,
          "source_status": "KNOWN"
        },
        "sgov_bond_bucket_amount": {
          "amount": "40.00",
          "currency": "USD"
        },
        "sgov_dry_powder_bucket_amount": {
          "amount": "60.00",
          "currency": "USD"
        },
        "v75_undeployed_to_sgov": null,
        "v82_undeployed_to_sgov": null,
        "roles_kept_separate": true,
        "v82_access_forbidden": true,
        "v82_raw_equity_budget_auto_route_forbidden": true,
        "final_aggregate_computed_in_work2": false,
        "physical_subledger_out_of_scope": true
      }
    },
    "v70_runtime_context": {
      "run_id": "w6-run-001",
      "source_namespace": "V70.RUNTIME_CONTEXT",
      "upstream_v70_snapshot_id": "v70-snap-W6",
      "snapshot_as_of": "2026-09-27T02:40:00+08:00",
      "payload": {
        "run_id": "w6-run-001",
        "stock_tactical_amount": "450.00",
        "bond_tactical_amount": "350.00",
        "v70_original_dry_powder_amount": "200.00",
        "value_state": "KNOWN",
        "data_quality": "OK",
        "issue_codes": []
      },
      "data_as_of": {
        "macro": "2026-09-27T02:40:00+08:00",
        "rates": {
          "curve": "2026-09-27T02:39:00+08:00"
        }
      },
      "source_reference_ids": [
        "V70-ref"
      ]
    },
    "shared_decision_context": {
      "run_id": "w6-run-001",
      "source_namespace": "LOOP2.SHARED_DECISION_CONTEXT",
      "context_id": "loop2-context-W6",
      "context_version": "source-context-v8",
      "as_of": "2026-09-27T02:44:00+08:00",
      "payload": {
        "macro": {
          "rates": "source-owned"
        },
        "market": {
          "snapshot_id": "market-W6"
        },
        "news": {
          "snapshot_id": "news-W6"
        }
      },
      "data_as_of": {
        "macro": {
          "timestamp": "2026-09-27T02:40:00+08:00"
        },
        "market": "2026-09-27T02:41:00+08:00",
        "news": {
          "timestamp": "2026-09-27T02:41:30+08:00"
        }
      },
      "source_reference_ids": [
        "market-ref",
        "macro-ref",
        "news-ref"
      ],
      "versions": {
        "macro": "m8",
        "market": "mk10",
        "news": "n5"
      }
    },
    "temporal": {
      "as_of": "2026-09-27T02:44:00+08:00",
      "data_as_of": {
        "C7": {
          "funding": "2026-09-27T02:42:00+08:00"
        },
        "V70": {
          "macro": {
            "timestamp": "2026-09-27T02:40:00+08:00"
          }
        },
        "V82": "2026-09-27T02:41:00+08:00",
        "V75": "2026-09-27T02:41:30+08:00"
      }
    },
    "versions": {
      "rule": {
        "V82": "V82-v1.21.0",
        "V75": "債券V75.md v2.7.0"
      },
      "data": {
        "shared_market": "snapshot-W6"
      },
      "schema": {
        "C7": "C-W7-FUND-v1.0.0",
        "W2": "C8C9-W2-UIC-v1.0.1-RECHECK1"
      }
    },
    "lineage": {
      "source_reference_ids": [
        "C7-ref",
        "V70-ref",
        "market-ref"
      ],
      "upstream_snapshot_ids": {
        "v70": "v70-snap-W6",
        "c7": "c7-snap-W6"
      }
    },
    "reason_status": {
      "source_reason_codes": {
        "C7": [],
        "V82": [],
        "V75": []
      },
      "source_status_codes": {
        "C7": "READY",
        "V82": "READY",
        "V75": "READY"
      },
      "integration_diagnostics": []
    },
    "engine_bindings": {
      "v82": {
        "consumer": "V82",
        "run_id": "w6-run-001",
        "owner": {
          "funding_domain": "US_BROKER",
          "broker": "QA_BROKER",
          "account": "QA_ACCOUNT"
        },
        "shared_context_id": "loop2-context-W6",
        "shared_context_digest_sha256": "7e153fc578283da9d1ae0b029fdc59ef41e0e1e6823fedd27637873ffe6bd4c9",
        "executable_budget_pointer": "/funding_context/executable_budget/equity",
        "remaining_target_gap_pointer": "/funding_context/remaining_target_gap/v82",
        "final_target_pointer": "/final_target",
        "authorization_reference": "C-W6-FINAL-W6-001",
        "v70_original_dry_powder_executable": false,
        "sgov_bucket_access": "FORBIDDEN"
      },
      "v75": {
        "consumer": "V75",
        "run_id": "w6-run-001",
        "owner": {
          "funding_domain": "US_BROKER",
          "broker": "QA_BROKER",
          "account": "QA_ACCOUNT"
        },
        "shared_context_id": "loop2-context-W6",
        "shared_context_digest_sha256": "7e153fc578283da9d1ae0b029fdc59ef41e0e1e6823fedd27637873ffe6bd4c9",
        "executable_budget_pointer": "/funding_context/executable_budget/bond",
        "remaining_target_gap_pointer": "/funding_context/remaining_target_gap/v75",
        "final_target_pointer": "/final_target",
        "sgov_context_access": "READ_ONLY_BOUNDARY_CONTEXT"
      }
    },
    "integration_diagnostics": []
  },
  "c7_funding_context": {
    "contract_name": "LivingWaterAI.C.Work7.FundingContext",
    "contract_version": "C-W7-FUND-v1.0.0",
    "run_id": "w6-run-001",
    "base_currency": "USD",
    "bank_cash_scope": "OUT_OF_SCOPE",
    "total_new_investment_amount": 1200.0,
    "contexts": [
      {
        "domain": "TW_LOCAL_BROKER",
        "broker": "TW_LOCAL",
        "account": "L1",
        "bucket_new_investment_amount": 100.0,
        "brokerage_cash_state": {
          "total": 100.0,
          "available": 100.0,
          "unsettled": 0.0,
          "reserved": 0.0
        },
        "executable_budget": {
          "equity": {
            "amount": 0.0,
            "cash_basis": "AVAILABLE",
            "source_domain": "TW_LOCAL_BROKER",
            "source_broker": "TW_LOCAL",
            "source_account": "L1"
          },
          "bond": {
            "amount": 0.0,
            "cash_basis": "AVAILABLE",
            "source_domain": "TW_LOCAL_BROKER",
            "source_broker": "TW_LOCAL",
            "source_account": "L1"
          }
        },
        "source_reference_ids": [
          "c7-local"
        ]
      },
      {
        "domain": "TW_SUB_BROKERAGE",
        "broker": "TW_SUB",
        "account": "S1",
        "bucket_new_investment_amount": 100.0,
        "brokerage_cash_state": {
          "total": 100.0,
          "available": 100.0,
          "unsettled": 0.0,
          "reserved": 0.0
        },
        "executable_budget": {
          "equity": {
            "amount": 0.0,
            "cash_basis": "AVAILABLE",
            "source_domain": "TW_SUB_BROKERAGE",
            "source_broker": "TW_SUB",
            "source_account": "S1"
          },
          "bond": {
            "amount": 0.0,
            "cash_basis": "AVAILABLE",
            "source_domain": "TW_SUB_BROKERAGE",
            "source_broker": "TW_SUB",
            "source_account": "S1"
          }
        },
        "source_reference_ids": [
          "c7-sub"
        ]
      },
      {
        "domain": "US_BROKER",
        "broker": "QA_BROKER",
        "account": "QA_ACCOUNT",